{
 "sheet": {
  "title": "AXIS LS",
  "sheet_id": null,
  "layout": {
   "orientation": "horizontal",
   "location_system": "zone_grid",
   "lines": "01–30",
   "columns": "A–M",
   "label_placement": "行番号は左側、列記号は上側",
   "junction_rule": "黒丸は接続を示す。黒丸のない交差は非接続。"
  }
 },
 "regions": [
  {
   "id": "machine_side",
   "label": "MACHINE SIDE",
   "kind": "area",
   "meaning": "機械側スイッチ"
  },
  {
   "id": "A11",
   "label": "TU(A11)",
   "kind": "unit",
   "meaning": "端子ユニット"
  },
  {
   "id": "A1",
   "label": "NC(A1)",
   "kind": "unit",
   "meaning": "PLC入力ユニット"
  }
 ],
 "rails": [
  {
   "name": "1L+",
   "polarity": "plus",
   "polarity_basis": {
    "value": "図中の1L+表記",
    "basis": "drawing",
    "evidence": [
     "行03、左側電源線の上に「1L+」と記載"
    ]
   },
   "point": "P15"
  }
 ],
 "components": [
  {
   "id": "A11",
   "name": "TU",
   "kind": "terminal unit",
   "symbol": "TU(A11)",
   "region": "A11",
   "purpose": null,
   "elements": [],
   "terminals": [
    {
     "name": "XT31:420",
     "point": "P19"
    },
    {
     "name": "X31:10",
     "point": "P20"
    },
    {
     "name": "X01:12",
     "point": "P22"
    },
    {
     "name": "XCS41:7/A4",
     "point": "P23"
    },
    {
     "name": "X51:16",
     "point": "P30"
    },
    {
     "name": "XT31:421",
     "point": "P38"
    },
    {
     "name": "X31:11",
     "point": "P39"
    },
    {
     "name": "X01:28",
     "point": "P40"
    },
    {
     "name": "XCS41:8/B4",
     "point": "P41"
    },
    {
     "name": "XT71:422",
     "point": "P60"
    },
    {
     "name": "X71:8",
     "point": "P61"
    },
    {
     "name": "X01:44",
     "point": "P62"
    },
    {
     "name": "XCS41:9/A5",
     "point": "P63"
    },
    {
     "name": "XT31:400",
     "point": "P86"
    },
    {
     "name": "X31:4",
     "point": "P87"
    },
    {
     "name": "X01:3",
     "point": "P89"
    },
    {
     "name": "XCS41:11/A6",
     "point": "P90"
    },
    {
     "name": "X51:10",
     "point": "P101"
    },
    {
     "name": "XT31:401",
     "point": "P112"
    },
    {
     "name": "X31:5",
     "point": "P117"
    },
    {
     "name": "X01:20",
     "point": "P118"
    },
    {
     "name": "XCS41:15/A8",
     "point": "P119"
    },
    {
     "name": "X51:11",
     "point": "P127"
    },
    {
     "name": "XT31:358",
     "point": "P131"
    },
    {
     "name": "X31:9",
     "point": "P136"
    },
    {
     "name": "X51:13",
     "point": "P128"
    },
    {
     "name": "XT31:402",
     "point": "P149"
    },
    {
     "name": "X31:6",
     "point": "P154"
    },
    {
     "name": "X01:35",
     "point": "P155"
    },
    {
     "name": "XCS41:12/B6",
     "point": "P156"
    },
    {
     "name": "XT31:403",
     "point": "P174"
    },
    {
     "name": "X31:8",
     "point": "P178"
    },
    {
     "name": "X01:2",
     "point": "P179"
    },
    {
     "name": "XCS41:16/B8",
     "point": "P180"
    },
    {
     "name": "XT71:358",
     "point": "P191"
    },
    {
     "name": "X71:7",
     "point": "P193"
    },
    {
     "name": "XT71:404",
     "point": "P203"
    },
    {
     "name": "X71:4",
     "point": "P204"
    },
    {
     "name": "X01:19",
     "point": "P205"
    },
    {
     "name": "XCS41:13/A7",
     "point": "P206"
    },
    {
     "name": "XT71:405",
     "point": "P234"
    },
    {
     "name": "X71:5",
     "point": "P239"
    },
    {
     "name": "X01:34",
     "point": "P240"
    },
    {
     "name": "XCS41:17/A9",
     "point": "P241"
    },
    {
     "name": "X85:37",
     "point": "P259"
    }
   ]
  },
  {
   "id": "A1",
   "name": "NC",
   "kind": "PLC input unit",
   "symbol": "NC(A1)",
   "region": "A1",
   "purpose": {
    "value": "PLC入力",
    "basis": "inferred",
    "evidence": [
     "X0.xxのアドレスと各入力コメントが記載されている"
    ]
   },
   "elements": [],
   "terminals": []
  }
 ],
 "plc_io": [
  {
   "address": "X0.00",
   "direction": "input",
   "port": "A1:X0.00",
   "point": "P22",
   "device": null,
   "comment": "X AXIS ZERO RETURN DEC LS"
  },
  {
   "address": "X0.01",
   "direction": "input",
   "port": "A1:X0.01",
   "point": "P40",
   "device": null,
   "comment": "Y AXIS ZERO RETURN DEC LS"
  },
  {
   "address": "X0.02",
   "direction": "input",
   "port": "A1:X0.02",
   "point": "P62",
   "device": null,
   "comment": "Z AXIS ZERO RETURN DEC LS"
  },
  {
   "address": "X0.04",
   "direction": "input",
   "port": "A1:X0.04",
   "point": "P89",
   "device": null,
   "comment": "+X AXIS OVERTRAVEL LS"
  },
  {
   "address": "X0.08",
   "direction": "input",
   "port": "A1:X0.08",
   "point": "P118",
   "device": null,
   "comment": "−X AXIS OVERTRAVEL LS"
  },
  {
   "address": "X0.05",
   "direction": "input",
   "port": "A1:X0.05",
   "point": "P155",
   "device": null,
   "comment": "+Y AXIS OVERTRAVEL LS"
  },
  {
   "address": "X0.09",
   "direction": "input",
   "port": "A1:X0.09",
   "point": "P179",
   "device": null,
   "comment": "−Y AXIS OVERTRAVEL LS"
  },
  {
   "address": "X0.06",
   "direction": "input",
   "port": "A1:X0.06",
   "point": "P205",
   "device": null,
   "comment": "+Z AXIS OVERTRAVEL LS"
  },
  {
   "address": "X0.10",
   "direction": "input",
   "port": "A1:X0.10",
   "point": "P240",
   "device": null,
   "comment": "−Z AXIS OVERTRAVEL LS"
  }
 ],
 "open_ends": [],
 "conventions": [],
 "cross_references": [
  {
   "text": "0700/23",
   "kind": "continuation",
   "component": null,
   "target_sheet": "0700",
   "target_line": 23,
   "target_page": null
  }
 ],
 "tables": [],
 "unresolved": [
  {
   "what": "図面集で参照される頁番号と頁名の対応",
   "reason": "この頁のタイトル欄はAXIS LSを示すが、図面集全体の頁番号対応を確定できなかった。"
  }
 ],
 "needs_review": [
  {
   "what": "PLC端子、現場スイッチの要素と接点の対応",
   "reason": "端子・PLC入力の線接続は追跡できたが、接点要素の端点を含む回路全体を検査で確定できなかった。検査では回路の筋ができず、PLC点とX01端子の重複も指摘された。",
   "ref": "SQ1–SQ9 / A1"
  },
  {
   "what": "SQ4–SQ9の連動接点構成と接点形式",
   "reason": "機械式連動接点の配置は読み取れるが、各接点の通常状態と要素への割り当てを確定できなかった。",
   "ref": "SQ4–SQ9"
  }
 ]
}